{
  "$schema": "https://json-schema.org/draft/2020-12/schema",
  "$id": "https://obtuse.ai/schemas/dumbmoney/dopey-robinhood-runner.v1.schema.json",
  "title": "DumbMoney Dopey Robinhood Windows runner public config",
  "type": "object",
  "additionalProperties": false,
  "required": [
    "schema",
    "service_name",
    "release_id",
    "core_endpoint_ref",
    "core_readiness_path",
    "core_cell_token_target",
    "robinhood_profile_target",
    "start_mode",
    "data_root",
    "readiness_ref",
    "readiness_path",
    "core_public_key_base64url",
    "operator_public_keys_base64url",
    "promoter_public_keys_base64url",
    "research_public_keys_base64url",
    "evaluator_public_keys_base64url",
    "expected_account_hash",
    "fund_lock_sha256",
    "service_manifest_sha256",
    "role_public_keys_sha256",
    "core_runner_config_sha256",
    "risk_policy_sha256",
    "readiness_signer_public_key_sha256",
    "codex_executable_path",
    "codex_executable_sha256",
    "codex_local_provider",
    "codex_local_model",
    "codex_local_model_digest",
    "ollama_executable_path",
    "ollama_executable_sha256",
    "ollama_process_identity_sid",
    "ollama_runtime_evidence_sha256",
    "poll_interval_seconds",
    "readiness_ttl_seconds"
  ],
  "properties": {
    "schema": {
      "const": "dopey.dumbmoney-robinhood-runner-config.v1"
    },
    "service_name": {
      "const": "DumbMoneyDopeyRobinhood"
    },
    "release_id": {
      "type": "string",
      "minLength": 1,
      "maxLength": 128
    },
    "core_endpoint_ref": {
      "const": "endpoint-ref:DumbMoneyCore"
    },
    "core_readiness_path": {
      "const": "C:\\ProgramData\\DumbMoney\\readiness\\DumbMoneyCore.json"
    },
    "core_cell_token_target": {
      "const": "credential-target:DumbMoney/DopeyCellToken"
    },
    "robinhood_profile_target": {
      "const": "credential-target:DumbMoney/RobinhoodProfile"
    },
    "start_mode": {
      "const": "RECONCILIATION_ONLY"
    },
    "data_root": {
      "const": "C:\\ProgramData\\DumbMoney\\dopey-robinhood"
    },
    "readiness_ref": {
      "const": "readiness-ref:DumbMoneyDopeyRobinhood"
    },
    "readiness_path": {
      "const": "C:\\ProgramData\\DumbMoney\\readiness\\DumbMoneyDopeyRobinhood.json"
    },
    "core_public_key_base64url": {
      "$ref": "#/$defs/public_key"
    },
    "operator_public_keys_base64url": {
      "$ref": "#/$defs/key_map"
    },
    "promoter_public_keys_base64url": {
      "$ref": "#/$defs/key_map"
    },
    "research_public_keys_base64url": {
      "$ref": "#/$defs/key_map"
    },
    "evaluator_public_keys_base64url": {
      "$ref": "#/$defs/key_map"
    },
    "expected_account_hash": {
      "$ref": "#/$defs/sha256"
    },
    "fund_lock_sha256": {
      "$ref": "#/$defs/sha256"
    },
    "service_manifest_sha256": {
      "$ref": "#/$defs/sha256"
    },
    "role_public_keys_sha256": {
      "$ref": "#/$defs/sha256"
    },
    "core_runner_config_sha256": {
      "$ref": "#/$defs/sha256"
    },
    "risk_policy_sha256": {
      "$ref": "#/$defs/sha256"
    },
    "readiness_signer_public_key_sha256": {
      "$ref": "#/$defs/sha256"
    },
    "codex_executable_path": {
      "type": "string",
      "minLength": 3,
      "maxLength": 1024
    },
    "codex_executable_sha256": {
      "$ref": "#/$defs/sha256"
    },
    "codex_local_provider": {
      "const": "ollama"
    },
    "codex_local_model": {
      "type": "string",
      "pattern": "^[a-z0-9][a-z0-9._-]*(/[a-z0-9][a-z0-9._-]*)*:[a-z0-9][a-z0-9._-]{0,63}$",
      "not": {
        "pattern": ":(latest|cloud)$"
      }
    },
    "codex_local_model_digest": {
      "$ref": "#/$defs/sha256"
    },
    "ollama_executable_path": {
      "type": "string",
      "minLength": 3,
      "maxLength": 1024
    },
    "ollama_executable_sha256": {
      "$ref": "#/$defs/sha256"
    },
    "ollama_process_identity_sid": {
      "type": "string",
      "pattern": "^S-1-5-([0-9]+-){1,14}[0-9]+$"
    },
    "ollama_runtime_evidence_sha256": {
      "$ref": "#/$defs/sha256"
    },
    "poll_interval_seconds": {
      "type": "integer",
      "minimum": 5,
      "maximum": 300
    },
    "readiness_ttl_seconds": {
      "type": "integer",
      "minimum": 10,
      "maximum": 120
    }
  },
  "$defs": {
    "sha256": {
      "type": "string",
      "pattern": "^[0-9a-f]{64}$"
    },
    "public_key": {
      "type": "string",
      "pattern": "^[A-Za-z0-9_-]{43}$"
    },
    "key_map": {
      "type": "object",
      "minProperties": 1,
      "maxProperties": 16,
      "additionalProperties": false,
      "patternProperties": {
        "^[0-9a-f]{64}$": {
          "$ref": "#/$defs/public_key"
        }
      }
    }
  }
}
