{
  "schema": "dopey.dumbmoney-robinhood-runner-config.v1",
  "service_name": "DumbMoneyDopeyRobinhood",
  "release_id": "TO_BE_RESOLVED",
  "core_endpoint_ref": "endpoint-ref:DumbMoneyCore",
  "core_readiness_path": "C:\\ProgramData\\DumbMoney\\readiness\\DumbMoneyCore.json",
  "core_cell_token_target": "credential-target:DumbMoney/DopeyCellToken",
  "robinhood_profile_target": "credential-target:DumbMoney/RobinhoodProfile",
  "start_mode": "RECONCILIATION_ONLY",
  "data_root": "C:\\ProgramData\\DumbMoney\\dopey-robinhood",
  "readiness_ref": "readiness-ref:DumbMoneyDopeyRobinhood",
  "readiness_path": "C:\\ProgramData\\DumbMoney\\readiness\\DumbMoneyDopeyRobinhood.json",
  "core_public_key_base64url": "TO_BE_RESOLVED",
  "operator_public_keys_base64url": {
    "TO_BE_RESOLVED": "TO_BE_RESOLVED"
  },
  "promoter_public_keys_base64url": {
    "TO_BE_RESOLVED": "TO_BE_RESOLVED"
  },
  "research_public_keys_base64url": {
    "TO_BE_RESOLVED": "TO_BE_RESOLVED"
  },
  "evaluator_public_keys_base64url": {
    "TO_BE_RESOLVED": "TO_BE_RESOLVED"
  },
  "expected_account_hash": "TO_BE_RESOLVED",
  "fund_lock_sha256": "TO_BE_RESOLVED",
  "service_manifest_sha256": "TO_BE_RESOLVED",
  "role_public_keys_sha256": "TO_BE_RESOLVED",
  "core_runner_config_sha256": "TO_BE_RESOLVED",
  "risk_policy_sha256": "TO_BE_RESOLVED",
  "readiness_signer_public_key_sha256": "TO_BE_RESOLVED",
  "codex_executable_path": "TO_BE_RESOLVED",
  "codex_executable_sha256": "TO_BE_RESOLVED",
  "codex_local_provider": "ollama",
  "codex_local_model": "TO_BE_RESOLVED",
  "codex_local_model_digest": "TO_BE_RESOLVED",
  "ollama_executable_path": "TO_BE_RESOLVED",
  "ollama_executable_sha256": "TO_BE_RESOLVED",
  "ollama_process_identity_sid": "TO_BE_RESOLVED",
  "ollama_runtime_evidence_sha256": "TO_BE_RESOLVED",
  "poll_interval_seconds": 15,
  "readiness_ttl_seconds": 90
}
